id,created_at,news
1419559849529126921,2021-07-26 07:26:56+00:00,"RT @BBCSport: TOM PIDCOCK HAS DONE IT! 

The 21-year-old has won gold in the men's cross country mountain biking! 🥇

#bbcolympics #Tokyo2020"
1419553881885917184,2021-07-26 07:03:14+00:00,"RT @BBCSport: GOLD!!! 🇬🇧🥇

Tom Daley and Matty Lee are the Olympic champions in the men's synchronised 10m diving! 

What a moment! ❤

Watc…"
1419483434846769155,2021-07-26 02:23:18+00:00,"RT @BBCSport: History is made!!! 🎉

Adam Peaty is a double Olympic champion.

He becomes the first British swimmer to ever defend their tit…"
1419246578930528257,2021-07-25 10:42:07+00:00,"UK Health Secretary Sajid Javid apologises for poor choice of word when he said people should no longer ""cower"" from Covid https://t.co/ScYuyuvTE5"
1418527160436932611,2021-07-23 11:03:24+00:00,"Tokyo’s 2020 Olympic opening ceremony gets under way, after a year’s delay as the world continues to battle Covid pandemic
https://t.co/I9yy1pXqNE"
1418316994441584645,2021-07-22 21:08:17+00:00,Key parts of UK's food industry will move to daily Covid testing after self-isolating workers led to some supply shortages https://t.co/GFQgd2m1IV
1418251921404608513,2021-07-22 16:49:42+00:00,"Major websites including HSBC bank, British Airways and PlayStation network hit by global outage https://t.co/iSG98pDSoK"
1418205621850017796,2021-07-22 13:45:43+00:00,"Sub-postmasters wrongly convicted of offences in Post Office IT scandal will get interim compensation of up to £100,000, UK government says

https://t.co/1QMTjEeI1t"
1417894291607805958,2021-07-21 17:08:36+00:00,Nurses and other NHS workers in England offered 3% pay rise by government 'in recognition of unique impact of pandemic' on staff https://t.co/3rDiHvxlD5
1417843421956481027,2021-07-21 13:46:28+00:00,UK Labour leader Sir Keir Starmer to self-isolate after one of his children tests positive for Covid https://t.co/wz61CJ8sOF
1417826758729027586,2021-07-21 12:40:15+00:00,"UK's Brexit minister says ""we cannot go on as we are"" as he pushes the EU to overhaul Northern Ireland trade agreement https://t.co/WzDeqFcWfv"
1417785214080851972,2021-07-21 09:55:10+00:00,Liverpool stripped of its Unesco World Heritage status due to developments on the city's waterfront https://t.co/dQQgfPxEI3
1417515722054459395,2021-07-20 16:04:18+00:00,"“He doesn't have a plan, he doesn't know how to be prime minister and we'd only got him in there because we had to solve a certain problem”

Dominic Cummings tells @BBCLauraK after the 2019 election he held talks about removing Boris Johnson from No 10

https://t.co/MphZJtpbRg https://t.co/LFudx4L0EN"
1417515644749336576,2021-07-20 16:04:00+00:00,"Dominic Cummings reveals he discussed removing Boris Johnson as prime minister, within days of the Conservatives winning the December 2019 general election

https://t.co/MphZJtpbRg"
1417473340055379968,2021-07-20 13:15:54+00:00,"Amazon billionaire Jeff Bezos blasts off towards space on first crewed flight of his rocket ship, New Shepard
https://t.co/GHGRIxkq26"
1417228446963544064,2021-07-19 21:02:47+00:00,"“We can’t kill the economy just because of people dying over 80”

Dominic Cummings, Boris Johnson’s former aide, claims the prime minister “put his own political interests ahead of people’s lives”

https://t.co/0LTD1wSloJ https://t.co/zu3dkfXxWl"
1417227982247272452,2021-07-19 21:00:56+00:00,"UK PM Boris Johnson resisted Covid lockdown last autumn as he thought the people dying were ""essentially all over 80"", ex-aide Dominic Cummings tells BBC https://t.co/zpkPKYw791"
1417155940676165632,2021-07-19 16:14:40+00:00,"Extreme heat weather warning issued in the UK by the Met Office for the first time ever, for parts of Wales and southern England

https://t.co/G4QVPbs1ze"
1417150218395693067,2021-07-19 15:51:56+00:00,"Children over 12 who are at higher risk of getting ill if they catch Covid will be offered the jab, the UK's vaccines minister has confirmed https://t.co/pyx131OLKl"
1416813569191067652,2021-07-18 17:34:12+00:00,"RT @BBCSport: 🏌️‍♂️ COLLIN MORIKAWA WINS #TheOpen! 

There's a new name on the Claret Jug! 

The 24-year-old shoots a final round of 66 to…"
1416700141919158274,2021-07-18 10:03:29+00:00,"UK PM Boris Johnson and Chancellor Rishi Sunak will now self-isolate after Health Secretary Sajid Javid tested positive for Covid, after criticism for joining pilot daily testing scheme

https://t.co/HqN323Lkc3"
1416379402506670083,2021-07-17 12:48:59+00:00,"UK Health Secretary Savid Javid tests positive for Covid, but says he has had two jabs and his symptoms are ""very mild""

https://t.co/OJmqR6yW1M"
1415917953145577475,2021-07-16 06:15:21+00:00,"Death toll in devastating German floods rises to at least 80, with hundreds unaccounted for in the worst-hit region and more rain forecast https://t.co/ZUoImnWkG9"
1415665943758389249,2021-07-15 13:33:57+00:00,"Dutch crime reporter Peter R de Vries, who was shot in central Amsterdam, has died https://t.co/Wf6eDosJR7"
1415649478166593536,2021-07-15 12:28:31+00:00,"'Catastrophic' flooding kills at least 33 in Germany, and at least four in neighbouring Belgium, with dozens more missing https://t.co/49FkObKWd0"
1415355396282363904,2021-07-14 16:59:57+00:00,"Majorca, Ibiza and Menorca added to England's amber list from Monday - meaning quarantine on return for travellers not fully vaccinated https://t.co/WQ3YXNmemP"
1415299725805375490,2021-07-14 13:18:44+00:00,European Union announces climate change legislation aimed at pushing it towards its goal of becoming carbon neutral by 2050 https://t.co/REN5AtdUgx
1415283413620252672,2021-07-14 12:13:55+00:00,"Legal limits on number of people who can meet in Wales to end on 7 August, but masks will still be required in some indoor spaces https://t.co/GBp0MyrI88"
1414965018874073091,2021-07-13 15:08:43+00:00,"£4bn cut to this year's UK foreign aid budget backed by MPs in Commons vote
https://t.co/w9yN2fafNJ"
1414936471388229641,2021-07-13 13:15:17+00:00,"Scotland to move to level zero of Covid restrictions on 19 July, but mandatory use of face coverings will remain in place for ""some time"", First Minister Nicola Sturgeon says https://t.co/jb2luCfDtx"
1414895566291718154,2021-07-13 10:32:45+00:00,"Double child killer Colin Pitchfork will be released, after Parole Board reject UK government challenge against its ruling https://t.co/rkO7GvMcXN"
1414605832134799360,2021-07-12 15:21:27+00:00,"""There will never be a perfect time to take this step because we simply cannot eradicate this virus”

Lockdown easing to go ahead in England on 19 July, Health Secretary Sajid Javid says

https://t.co/ynel6YM9TK"
1414600188019322891,2021-07-12 14:59:01+00:00,Health Secretary Sajid Javid confirms England will move to final stage of unlocking of Covid restrictions on 19 July https://t.co/E5GRyQkN2g
1414343693407035399,2021-07-11 21:59:48+00:00,Italy beat England on penalties 3-2 to become Euro 2020 champions https://t.co/JRQJQTWX6x
1414262330972594183,2021-07-11 16:36:30+00:00,"RT @BBCSport: Novak Djokovic has won his 20th Grand Slam men's singles title. 

He moves level with Roger Federer and Rafael Nadal after be…"
1414249588802916359,2021-07-11 15:45:52+00:00,"British billionaire Sir Richard Branson reaches edge of space on his rocket plane, according to his company Virgin Galactic https://t.co/Bod2O1u2Vs"
1413877200215027712,2021-07-10 15:06:07+00:00,"RT @BBCSport: Australian Ashleigh Barty has become #Wimbledon women's singles champion for the very first time, beating Karolina Pliskova 6…"
1413522273575874562,2021-07-09 15:35:46+00:00,"Britain's Mark Cavendish makes history in the Tour de France, matching Eddy Merckx's record of 34 Tour stage wins https://t.co/vaqtj6njW0"
1413434327178694661,2021-07-09 09:46:18+00:00,"Police officer Wayne Couzens pleads guilty to murdering Sarah Everard, whose body was found a week after she disappeared while walking home in London in March https://t.co/m01qzaXNz3"
1413127740069400576,2021-07-08 13:28:02+00:00,Spectators banned from Tokyo Olympic Games due to state of emergency announced in response to surge in Covid cases https://t.co/diC4mUW7a5
1413088700548980743,2021-07-08 10:52:54+00:00,Fully jabbed UK residents and children under 18 returning to England from amber list destinations will no longer have to self-isolate from 19 July https://t.co/6wFCfUvU2p
1413085447287345156,2021-07-08 10:39:59+00:00,"Uefa announce disciplinary proceedings against England, after laser pointer directed at Danish goalkeeper Kasper Schmeichel during Euro 2020 semi-final https://t.co/6Cku0mCk1k"
1413065860600709123,2021-07-08 09:22:09+00:00,"Japan has declared a state of emergency in Tokyo which will run throughout the Olympic Games, as Covid cases rise https://t.co/y5XGhwBr1M"
1412888358519517185,2021-07-07 21:36:49+00:00,"RT @BBCSport: THEY HAVE DONE IT.

ENGLAND ARE #EURO2020 FINALISTS.

For the first time since 1966, England are in the final of a major men’…"
1412822320935227403,2021-07-07 17:14:24+00:00,"RT @BBCSport: 🚨 A huge shock on Centre Court! 🚨

World number 18 Hubert Hurkacz has beaten eight-time champion Roger Federer in straight se…"
1412800765404581891,2021-07-07 15:48:45+00:00,"Former US president Donald Trump announces plans to sue tech giants Google, Twitter and Facebook, claiming he is the victim of censorship

https://t.co/mv0dTk8ltz"
1412721112539140099,2021-07-07 10:32:14+00:00,"President of Haiti Jovenel Moise killed during attack on his residence in Port-au-Prince, interim PM Claude Joseph says https://t.co/of7MLBKVZI"
1412712874036936705,2021-07-07 09:59:30+00:00,The megaship Ever Given that blocked the Suez Canal is finally leaving the waterway after compensation deal struck with Egypt https://t.co/IOd1FnfMKz
1412699529321893888,2021-07-07 09:06:29+00:00,"Olympic torch relay in Tokyo cancelled, as fears over the spread of Covid-19 continue to threaten the Games https://t.co/vKlyjQlLaU"
1412527622274400262,2021-07-06 21:43:23+00:00,"RT @BBCSport: ITALY ARE #EURO2020 FINALISTS!

Jorginho slotted the winning penalty after Alvaro Morata's spot kick was saved.

📲📺 Watch: ht…"
1412383018258505733,2021-07-06 12:08:47+00:00,"UK Health Secretary Sajid Javid confirms people in England who are a close contact of a positive Covid case ""will no longer have to self-isolate if they have been fully vaccinated"" from 16 August

https://t.co/smdFyVBrye https://t.co/WHkrBdHONG"
1412379289371152386,2021-07-06 11:53:57+00:00,"Double-jabbed people in England will not have to self-isolate after close contact with a positive Covid case from 16 August, says Health Secretary Sajid Javid https://t.co/nMNs15uTyD"
1412082830788681738,2021-07-05 16:15:56+00:00,UK PM Boris Johnson confirms that all legal Covid restrictions in England will end at Step 4 of the roadmap - expected to be on 19 July https://t.co/5jJnOP3GBB
1411428784650264580,2021-07-03 20:56:59+00:00,"RT @BBCSport: FT #UKR 0-4 #ENG

England are into the #euro2020 semi-finals!!!

Watch and listen on the BBC #euro2020 #bbceuro2020 #UKRENG"
1410900738092326912,2021-07-02 09:58:43+00:00,Man charged with common assault after England's chief medical officer Prof Chris Whitty accosted by group of men in a London park https://t.co/oXnmmXme5C
1410828414827773954,2021-07-02 05:11:20+00:00,"Labour Party wins Batley and Spen by-election after closely-fought campaign, with narrow majority of 323 https://t.co/mRCkdDh8lu"
1410603052126466073,2021-07-01 14:15:50+00:00,"Prince William and Prince Harry unveil statue of their mother, Diana, Princess of Wales, on what would have been her 60th birthday https://t.co/4U2XjLw0ZW"
1410320625453965316,2021-06-30 19:33:34+00:00,"Former US defence secretary Donald Rumsfeld, one of the main architects of the Iraq war, dies at 88 https://t.co/N4jvaDkaPi"
1410283196890103810,2021-06-30 17:04:50+00:00,"US comedian Bill Cosby's sex assault conviction overturned by top Pennsylvania court, paving the way for his release https://t.co/9JFWX1X66o"
1409932623129026560,2021-06-29 17:51:47+00:00,"RT @BBCSport: ENGLAND HAVE DONE IT! 🔥

#ENG 2-0 #GER

Raheem Sterling and Harry Kane's goals secure England's place in the quarter-finals o…"
1409861260565532674,2021-06-29 13:08:13+00:00,"Foreign business leaders no longer need to quarantine when arriving in England if trip likely to have significant economic benefit to UK, government announces https://t.co/vWMdaiaqFM"
1409811756021657600,2021-06-29 09:51:30+00:00,South Africa's former President Jacob Zuma sentenced to 15 months in prison by highest court in the country https://t.co/vBvk5TXm6T
1409528789982486533,2021-06-28 15:07:05+00:00,"Any combination of Pfizer or AstraZeneca Covid vaccine doses gives good protection against coronavirus, UK study suggests

https://t.co/KX158r9ItA"
1409044749508657154,2021-06-27 07:03:41+00:00,Classified government documents containing details about warship HMS Defender and the British military in Afghanistan found at a bus stop https://t.co/pBfojjChFn
1408861731741392897,2021-06-26 18:56:26+00:00,Former chancellor and home secretary Sajid Javid to replace Matt Hancock as health secretary https://t.co/Ww1p1EAff3
1408846375358451712,2021-06-26 17:55:25+00:00,"RT @BBCSport: FT #WAL 0-4 #DEN 

Wales' Euro 2020 story has come to an end.

They were outplayed by Denmark, who are heading through to the…"
1408842471505813505,2021-06-26 17:39:54+00:00,"""Those of us who make these rules have got to stick by them, and that's why I've got to resign""

In a video, posted on his Twitter account, the Health Secretary Matt Hancock says he has ""been to see the prime minister to resign""

https://t.co/4Q7bIQGShc https://t.co/Gys3iwmoiU"
1408837952889933827,2021-06-26 17:21:57+00:00,Matt Hancock resigns as health secretary after breaking social distancing rules by kissing a colleague https://t.co/0fjwMedW6B
1408514959072501765,2021-06-25 19:58:29+00:00,A US judge jails former police officer Derek Chauvin for 22-and-a-half years for the murder of George Floyd on a Minneapolis street https://t.co/fMd2tGM2i2
1408462211396276231,2021-06-25 16:28:53+00:00,Chinese researchers unveil ancient skull that could belong to a completely new species of human https://t.co/Ve5raGIwFG
1408410740051042305,2021-06-25 13:04:22+00:00,"Rescuers are desperately searching for survivors after the Miami building collapse

Here's what we know so far

https://t.co/ue7g9IDRpG"
1408407971030310913,2021-06-25 12:53:21+00:00,"At least four killed and 159 still missing after Miami building collapse, officials say https://t.co/QUzJCSRI7P"
1408387558065807361,2021-06-25 11:32:15+00:00,"UK Health Secretary Matt Hancock admits breaking social distancing rules with aide and says sorry for letting people down

https://t.co/BTXCLNaeTY"
1408146917691899904,2021-06-24 19:36:01+00:00,"UK government intends to drop quarantine rules for its fully-jabbed residents returning from amber-list countries ""later in the summer"", transport secretary says https://t.co/6z5vdJ6KYo"
1408134704554037263,2021-06-24 18:47:30+00:00,"Spain’s Balearic Islands, Barbados, Bermuda, Malta and Madeira among places added to green list for travellers returning to UK without quarantine https://t.co/9irXy1hJ3f"
1408086405541150734,2021-06-24 15:35:34+00:00,"At least 751 unmarked graves found at the site of a former residential school in Saskatchewan, Canada, indigenous group says https://t.co/DtWEu53xe6"
1407989462328619010,2021-06-24 09:10:21+00:00,"Junk food TV adverts to be banned before 9pm in UK, government says
https://t.co/rx3wrn2TMy"
1407821946830610433,2021-06-23 22:04:42+00:00,'I am traumatised' - US pop star Britney Spears gives revealing testimony to court about her guardianship https://t.co/a8QNEh2CP3
1407788080157843463,2021-06-23 19:50:08+00:00,"US computer anti-virus tycoon John McAfee found dead in Spanish prison cell after court allows his extradition on tax evasion charges
https://t.co/nBWkwH9wjl"
1407677351543164929,2021-06-23 12:30:08+00:00,"UK Ministry of Defence denies Russia's claims about firing shots near British warship HMS Defender, adding the ship was sailing through Ukrainian waters

https://t.co/Pu6Atz8B8e"
1407666530616332290,2021-06-23 11:47:08+00:00,"Russia says warning shots fired and bombs dropped in path of UK Royal Navy destroyer ship, after it allegedly entered country’s territorial waters

https://t.co/UDKpDPiUVo"
1407601619013931008,2021-06-23 07:29:12+00:00,Hong Kong's outspoken pro-democracy paper Apple Daily announces closure after assets freeze in major blow to media freedom https://t.co/T1N6lUaG9K
1407338309731377154,2021-06-22 14:02:54+00:00,"Lockdown easing paused in Scotland with no mainland areas moving to lowest level zero restrictions next week, First Minister Nicola Sturgeon confirms https://t.co/TSErLrpFaD"
1406896917649440768,2021-06-21 08:48:58+00:00,"Tokyo 2020 Olympics to allow up to 10,000 domestic spectators at venues, despite warnings from health chiefs

https://t.co/1pnTuGlGtf"
1405622818390355979,2021-06-17 20:26:09+00:00,Edwin Poots resigns as Northern Ireland's DUP leader after three weeks in the job amid an internal party revolt https://t.co/Xdvuy0MH2k
1405513183528472579,2021-06-17 13:10:30+00:00,"Manchester Arena bomber Salman Abedi should have been identified as a threat by those in charge of security, inquiry finds https://t.co/7VHSGFkHLa"
1405128378894663681,2021-06-16 11:41:26+00:00,"Dominic Cummings publishes expletive-filled messages apparently from Boris Johnson, in which the UK prime minister describes Health Secretary Matt Hancock as ""hopeless"" https://t.co/9lWrPG6Q8v"
1404934987858731011,2021-06-15 22:52:58+00:00,"Israeli air strikes hit Gaza, after Palestinian militants sent incendiary balloons into Israel https://t.co/rwyXpUc1Bd"
1404766060381933573,2021-06-15 11:41:42+00:00,"London's Met Police accused of ""institutional corruption"" for failings over unsolved murder of private investigator Daniel Morgan https://t.co/IS903gInJg"
1404561725748301825,2021-06-14 22:09:45+00:00,"Broad terms of UK-Australia trade deal agreed, BBC understands, with formal announcement expected on Tuesday https://t.co/GwkeHuknKe"
1404488521985953792,2021-06-14 17:18:52+00:00,"UK PM Boris Johnson confirms four-week delay to final easing of coronavirus restrictions in England, but “confident” no delay beyond 19 July will be needed

https://t.co/rUdRoRZhAc"
1404487897349345282,2021-06-14 17:16:23+00:00,"“By Monday 19 July we will aim to have double jabbed two thirds of the adult population”

UK PM Boris Johnson says “it is sensible to wait just a little longer” as he outlines delay to lifting further restrictions 

Latest: https://t.co/Bvho1LCfzH https://t.co/8w8G868y3c"
1404136184994009088,2021-06-13 17:58:48+00:00,Benjamin Netanyahu loses his 12-year hold on power as Israel's parliament approves new coalition government https://t.co/gadmR8Y3VR
1404065408538365953,2021-06-13 13:17:34+00:00,"World leaders have pledged to provide one billion coronavirus vaccine doses globally by next year, says UK PM Boris Johnson https://t.co/rZVnLr81Ya"
1403770974827339790,2021-06-12 17:47:35+00:00,"RT @BBCSport: Christian Eriksen ""has been transferred to the hospital and has been stabilised"" after collapsing on the pitch during Denmark…"
1403427482771001351,2021-06-11 19:02:40+00:00,"Euro 2020 kicks off after it was delayed due to the pandemic, with Italy playing Turkey in Rome https://t.co/T4ULxfSciB"
1402566822956777483,2021-06-09 10:02:43+00:00,"UK government acted unlawfully when it gave contract worth £560,000 to company run by friends of PM's former chief adviser Dominic Cummings, High Court rules

https://t.co/npMKdYyWr5"
1402269896440942593,2021-06-08 14:22:50+00:00,UN court rejects former Bosnian Serb commander Ratko Mladic's appeal against conviction for genocide https://t.co/FX5rIhQB3Y
1402256751139999756,2021-06-08 13:30:36+00:00,Two people arrested after French President Emmanuel Macron slapped in the face https://t.co/W3cFLHDPzE
1402212822340222981,2021-06-08 10:36:03+00:00,"Number of major government and media websites currently not working, including Guardian, FT, Independent and New York Times https://t.co/bT3JHu6Kt2"
1402192688796012546,2021-06-08 09:16:03+00:00,"Wayne Couzens admits kidnap and rape of Sarah Everard, whose body was found a week after she disappeared walking home in London in March https://t.co/Hugo7CEd4W"
1401921424168738829,2021-06-07 15:18:08+00:00,"First new treatment for Alzheimer's disease for nearly 20 years, aducanumab, approved by regulators in the US
https://t.co/yTa1mpmRdk"
1401864865548058624,2021-06-07 11:33:23+00:00,"Body of baby found washed up on Norway's coast in January was child who drowned in English Channel in October, say police https://t.co/3PzR2JrVdL"
1401858129550323712,2021-06-07 11:06:38+00:00,"Double child killer who was the first murderer to be convicted using DNA evidence can be released, Parole Board confirms 

https://t.co/EuFFY4VSNd"
1401570735735422986,2021-06-06 16:04:37+00:00,"Prince Harry and Meghan, the Duke and Duchess of Sussex, announce the birth of their second child - daughter Lilibet “Lili” Diana Mountbatten-Windsor https://t.co/ciov37nJbP"
1401136708041777156,2021-06-05 11:19:57+00:00,Leading world economies back ‘historic’ plan to tax multinational companies and limit tax avoidance https://t.co/yT855fQTUz
1400759312490901505,2021-06-04 10:20:19+00:00,"Pfizer Covid vaccine approved for use in 12 to 15-year-olds in UK by medicines regulator, who say it is safe and effective and benefits outweigh risks
https://t.co/MFlIT1caWW"
1400420831830974470,2021-06-03 11:55:19+00:00,"No further countries will be added to the UK's travel green list, as ministers prepare to update travellers on quarantine-free destinations  

https://t.co/3vdcBngn22"
1400190166648688647,2021-06-02 20:38:44+00:00,"Israel opposition parties agree to form new unity government, meaning an end to Benjamin Netanyahu's 12-year tenure as prime minister https://t.co/8zRvLkHGqu"
1399743328397185026,2021-06-01 15:03:10+00:00,Zero daily Covid deaths announced in the UK for the first time since pandemic began https://t.co/76y78NSOiv
1399269525921710082,2021-05-31 07:40:26+00:00,"China allows couples to have up to three children in major policy shift sparked by falling birth rate 

https://t.co/ajoyUOoti7"
1399056726310199302,2021-05-30 17:34:51+00:00,Key right-wing Israeli opposition party backs unity government which may end PM Netanyahu's 12 years in office https://t.co/huuJ72uXRu
1398916911329689602,2021-05-30 08:19:16+00:00,"UK Prime Minister Boris Johnson and Carrie Symonds were married in a small ceremony at Westminster Cathedral on Saturday, No 10 confirms
https://t.co/3EA2jGhFSJ"
1398745481191251974,2021-05-29 20:58:04+00:00,"RT @BBCSport: Chelsea are Champions League winners for a second time! 🏆🏆

They've beaten Manchester City 1-0 in Porto.

Party time for Thom…"
1398669449646022662,2021-05-29 15:55:57+00:00,"RT @BBCSport: Brentford are in the Premier League! 🥳

The 74-year wait to return to the top-flight of English football is over!

FT: Brentf…"
1398286540464328704,2021-05-28 14:34:24+00:00,"UK PM Boris Johnson did not break ministerial code over funding of Downing Street flat refurbishment, report says https://t.co/abmTs24cyc"
1398256271967625222,2021-05-28 12:34:08+00:00,"""Unacceptable management"" of Usman Khan by UK state agencies contributed to deaths of two people stabbed in Fishmongers' Hall terror attack in London, inquest jury finds https://t.co/fKwS4yEKVJ"
1398243152968966145,2021-05-28 11:42:00+00:00,"Janssen single-dose Covid vaccine approved for use by UK medicines regulator, and will be available later this year https://t.co/NPU8rV3dmC"
1397588619188125702,2021-05-26 16:21:07+00:00,"Suspected gunman dead after opening fire in commuter train yard in California, killing ""multiple"" people, police say https://t.co/ALFgCmAnyZ"
1397539057014611972,2021-05-26 13:04:10+00:00,Five people held on suspicion of attempted murder of prominent Black Lives Matter activist Sasha Johnson in London https://t.co/6y9OG7xFDp
1397490052368896001,2021-05-26 09:49:27+00:00,Two retired police officers and ex-solicitor who had been accused of altering police statements after Hillsborough football disaster acquitted as trial collapses https://t.co/a9gNAwH5Vv
1397471078776287232,2021-05-26 08:34:03+00:00,"Dominic Cummings, UK Prime Minister Boris Johnson's former aide, quizzed by MPs about government decisions during Covid pandemic"
1396835133483802626,2021-05-24 14:27:02+00:00,"Max Mosley, British racing driver who went on to run motorsport and become a prominent privacy campaigner, dies aged 81 https://t.co/FjsLH75H8S"
1396799266853695489,2021-05-24 12:04:31+00:00,"BBC chairman announces review into editorial oversight and whistleblowing, in wake of report into 1995 interview with Diana, Princess of Wales

https://t.co/JRpntQqEsQ"
1396441011866460164,2021-05-23 12:20:56+00:00,"At least eight killed after cable car falls near Lake Maggiore in northern Italy, rescuers say https://t.co/QYGmjB7qGc"
1396100238105092103,2021-05-22 13:46:49+00:00,"New photo appears to show Dubai's missing Princess Latifa, who has not been seen or heard from in months https://t.co/wxFghrMvGy"
1396077756715356162,2021-05-22 12:17:29+00:00,"Lord Hall, BBC's ex-director general, resigns as National Gallery chairman, saying continuing would be a ""distraction"" after inquiry into Diana interview https://t.co/kjYkymOqQt"
1395485018483568643,2021-05-20 21:02:09+00:00,"Prince William blames BBC leaders for failing his mother Diana, after a “deceitful” interview worsened her marriage https://t.co/78eeoSnHVw"
1395464671155654661,2021-05-20 19:41:18+00:00,Israel agrees ceasefire after 11-day conflict with Palestinian militants which killed 232 in Gaza and 12 in Israel https://t.co/6TJNwB84Cn
