id,created_at,news
1536373274547871744,2022-06-13 15:41:47+00:00,Appeal court judges refuse to stop Home Office flight to Rwanda taking asylum seekers from UK https://t.co/LEJH4orPNx
1536363125380943872,2022-06-13 15:01:27+00:00,"Police deny bodies found of missing Amazon pair 

https://t.co/7IaZNfrmiQ"
1536335297423847424,2022-06-13 13:10:53+00:00,"Bodies found in search for journalist Dom Phillips and indigenous expert Bruno Pereira missing in the Amazon, local media say https://t.co/IJrALQVOUz"
1536301196394348544,2022-06-13 10:55:22+00:00,"Brain-damaged 12-year-old Archie Battersbee is officially dead and his treatment should end, UK's High Court rules https://t.co/UES47BWi5x"
1535314768059412486,2022-06-10 17:35:40+00:00,"The first flight to take asylum seekers from the UK to Rwanda next Tuesday is allowed to go ahead, High Court rules https://t.co/DPvOd32Znl"
1534899103448064001,2022-06-09 14:03:57+00:00,"Two British men and a Moroccan sentenced to death in Russian-occupied eastern Ukraine, in a trial seen as breaching international law

https://t.co/df6oVc456p"
1534793920034574337,2022-06-09 07:06:00+00:00,UK energy firms told by regulator to improve response to storms after thousands of homes left without power in Storm Arwen last year https://t.co/3lyZUIZvxi
1534538007264501763,2022-06-08 14:09:05+00:00,Harvey Weinstein to be charged with indecent assault in UK https://t.co/E3u5u0eQUA
1533902447625789440,2022-06-06 20:03:36+00:00,"UK PM Boris Johnson wins vote of confidence despite a substantial rebellion by Tory MPs - 211 voted for him and 148 against

https://t.co/VLD0nmfQzz"
1533709422140211200,2022-06-06 07:16:35+00:00,Prime Minister Boris Johnson to face vote of confidence today after Conservative MPs call for leadership ballot https://t.co/AsxGXTcOs1
1533509270779613186,2022-06-05 18:01:16+00:00,"RT @BBCSport: WALES. HAVE. DONE. IT.

A 1-0 win over Ukraine in the play-off final gets the job done! 

The 64-year wait to appear at a Wor…"
1533505446744662017,2022-06-05 17:46:04+00:00,"Queen says she is ""humbled and deeply touched"" by Jubilee celebrations, adding ""my heart has been with you all""

https://t.co/cRJJup0lGq"
1533481486191665152,2022-06-05 16:10:51+00:00,"Queen appears on Buckingham Palace balcony, joined by three generations of her family, at finale of Jubilee celebrations 

https://t.co/2X8blcJGEm"
1533195588249997313,2022-06-04 21:14:48+00:00,"""You laugh and cry with us"": Prince Charles pays tribute to his ""mummy"" the Queen at Platinum Jubilee concert https://t.co/66ZSGxQqA5"
1532670831347830785,2022-06-03 10:29:36+00:00,"Royal Family and politicians arrive for service of thanksgiving, as Queen rests at Windsor on day two of Platinum Jubilee celebrations

https://t.co/3JJMShcNUa"
1532373467554881543,2022-06-02 14:47:59+00:00,Prince Andrew has tested positive for Covid and will miss Jubilee thanksgiving service on Friday https://t.co/82Lxn50Szz
1532084917634486272,2022-06-01 19:41:23+00:00,"Amber Heard wins one of her counterclaims for defamation against Johnny Depp and is awarded $2m

https://t.co/Fw0lF1xBiI"
1532080536478527489,2022-06-01 19:23:59+00:00,"Johnny Depp has won his defamation case against ex-wife Amber Heard, who he sued over claims of domestic abuse

https://t.co/CVttyeVT3o"
1532058871845761024,2022-06-01 17:57:53+00:00,"A verdict is expected shortly in the high-profile defamation battle between Johnny Depp and Amber Heard

Follow the latest https://t.co/ghkRhmzAn1"
1531937695248879616,2022-06-01 09:56:23+00:00,Footballer Kurt Zouma ordered to carry out 180 hours of community service after he kicked and slapped his pet cat https://t.co/zyf7Xgg51v
1531698129204137985,2022-05-31 18:04:26+00:00,UK opposition leader Sir Keir Starmer and deputy Angela Rayner receive police questionnaires as part of inquiry into alleged Covid rule-breaking https://t.co/JcDefugjCE
1530959532993683456,2022-05-29 17:09:31+00:00,US authorities to review police response to Texas primary school shooting which left 19 children and two teachers dead https://t.co/yWp45w7waY
1530663435226255361,2022-05-28 21:32:55+00:00,Real Madrid beat Liverpool 1-0 in Champions League final thanks to second-half goal from Vinicius Jr – reaction here https://t.co/exNAjqyjiN
1530233710599098369,2022-05-27 17:05:21+00:00,"Police made ""wrong decision"" by failing to storm classroom in Uvalde as gunman killed children inside, chief Texas safety official says https://t.co/IbbOpUGsYM"
1529917488661667840,2022-05-26 20:08:48+00:00,"Depeche Mode keyboardist Andy Fletcher has died, band announces on social media https://t.co/YLgkb1E4L6"
1529833464576593923,2022-05-26 14:34:55+00:00,"Actor Kevin Spacey charged with four counts of sexual assault against three men in the UK, Crown Prosecution Service says

https://t.co/sGFTXcbC3f"
1529791725731979268,2022-05-26 11:49:04+00:00,"Every household in Britain to get energy bill discount of £400 this autumn to tackle soaring prices
https://t.co/3zGfJ9qvY9"
1529409332177149953,2022-05-25 10:29:34+00:00,"Sue Gray's report on Downing Street lockdown parties has just been published - follow live as we lay out the details, the photos and what it all means

https://t.co/UuymILFJwo"
1529206979968831488,2022-05-24 21:05:29+00:00,"At least 15 dead in Texas primary school shooting 

Live updates: https://t.co/uH3H5w9fpg"
1529202970923094016,2022-05-24 20:49:34+00:00,UK railway workers in RMT union vote in favour of strike action across Network Rail and 13 train operating companies https://t.co/0qg8Bz17i1 https://t.co/5AFfX6YBMX
1529097084053377025,2022-05-24 13:48:48+00:00,"14-year-old boy found guilty of murdering Ava White, 12, who was stabbed to death while out with friends in Liverpool last November https://t.co/hET0zl4SSP

https://t.co/hET0zl4SSP"
1529070475187462146,2022-05-24 12:03:04+00:00,"Downing Street insiders tell BBC Panorama about lockdown parties and bins overflowing with bottles

https://t.co/vybKci0gjy"
1529065520128983040,2022-05-24 11:43:23+00:00,"Energy price cap in UK expected to rise to £2,800 in October - up by more than £800, regulator warns https://t.co/wbBvxWXm3t"
1528745988608995328,2022-05-23 14:33:41+00:00,Former Conservative MP Imran Ahmad Khan jailed for 18 months for sexually assaulting 15-year-old boy at party in 2008 https://t.co/EHOgf9QEJZ
1528707809675825152,2022-05-23 12:01:58+00:00,Nazanin Zaghari-Ratcliffe tells BBC she was forced to sign false confession at the airport before being released by Iran https://t.co/bMikTNwDmM
1528677745210839040,2022-05-23 10:02:30+00:00,Russian tank commander given life sentence in Ukraine over killing of unarmed civilian at first war crimes trial since invasion https://t.co/mnokWUinSq
1528419748857491457,2022-05-22 16:57:19+00:00,"Manchester City win English Premier League title with a dramatic comeback victory in the final minutes of the season
 
https://t.co/4sQ2UlzfxZ"
1527981178086727680,2022-05-21 11:54:36+00:00,"Australian PM Scott Morrison removed from power as the country elects its first Labor government in almost a decade, local networks project

https://t.co/7EfFM5v9Hb"
1527327155247452160,2022-05-19 16:35:44+00:00,"MI5 agent used secret status to terrorise his girlfriend, including carrying out a machete attack - BBC investigation reveals https://t.co/Bo4cKbDHZn"
1527227894753378311,2022-05-19 10:01:19+00:00,"London's Metropolitan Police ends investigation into lockdown parties in Downing Street

https://t.co/Si89Ax0gMr"
1527224238549004289,2022-05-19 09:46:47+00:00,"UK’s biggest ever lottery winners, who won £184m jackpot on a lucky dip ticket, say they now have “time to dream""
https://t.co/pikyHVE7aq"
1526897226093580288,2022-05-18 12:07:21+00:00,Russian soldier accused of killing unarmed Ukrainian civilian pleads guilty in first war crimes trial of the conflict https://t.co/eCKxFPiULU
1526611801579864064,2022-05-17 17:13:11+00:00,"UK MP arrested on suspicion of sexual offences, including rape and sexual assault, over seven-year period https://t.co/uTmzR8beVM"
1526516120232112128,2022-05-17 10:52:59+00:00,"Queen makes surprise visit to Paddington station to see completed Elizabeth line

https://t.co/cozTf9Z4Us"
1526315288110800900,2022-05-16 21:34:56+00:00,"Hundreds of Ukrainian fighters holed up in Azovstal steel plant in Mariupol for over two months have left, senior Ukrainian official says https://t.co/hIjqHkETmS"
1526241396344213505,2022-05-16 16:41:19+00:00,Blackpool footballer Jake Daniels becomes first openly gay UK male professional footballer in decades https://t.co/ixGIcgvsIF
1525613633832624134,2022-05-14 23:06:49+00:00,Ukraine wins the Eurovision Song Contest as folk-rap group Kalush Orchestra ride a wave of public support to be crowne https://t.co/5Tncxuv44d
1525545494532997122,2022-05-14 18:36:03+00:00,Liverpool beat Chelsea in the FA cup final at Wembley after a deadlocked game went to penalties - reaction https://t.co/90ipkdnw0K
1525435650438225920,2022-05-14 11:19:34+00:00,"""No shelling for days"" - Kharkiv's mayor tells BBC that Russian forces have withdrawn far out from Ukraine's second city

Follow live updates https://t.co/53QuMbHc02"
1524860223378407435,2022-05-12 21:13:02+00:00,"Damehood given to BBC podcast host Deborah James, days after she revealed she is receiving end-of-life care for her bowel cancer
 
https://t.co/ZKOrpeyOx7"
1524743010113757184,2022-05-12 13:27:16+00:00,Gargantuan black hole at the centre of our galaxy pictured for very first time https://t.co/LYu44C0GWL
1524741552324685824,2022-05-12 13:21:29+00:00,Russian soldiers caught on camera shooting unarmed Ukrainian civilians in the back in footage seen by the BBC https://t.co/RipvjvQBDW
1524682468518993920,2022-05-12 09:26:42+00:00,"Another 50 fines to be issued over Covid lockdown rule breaking in and around Downing Street, London police say https://t.co/4H1sY1JTHF"
1524650918528049152,2022-05-12 07:21:20+00:00,"Finland must apply for Nato membership without delay, its leaders announce, after Russia's invasion of Ukraine https://t.co/g9dAfBQJwt"
1524362391663828993,2022-05-11 12:14:50+00:00,"UK and Sweden sign mutual security deal, pledging support if either country comes under attack https://t.co/yDwMhPhnTB"
1523716004005695488,2022-05-09 17:26:19+00:00,"Queen pulls out of reading the Queen's Speech at this year's State Opening of Parliament, Buckingham Palace announces

https://t.co/cayUkH8reg"
1523684121226133509,2022-05-09 15:19:37+00:00,UK opposition leader Labour's Keir Starmer says he'll quit if given Covid fine by police https://t.co/5QZxxJFQBI
1523620472931471360,2022-05-09 11:06:42+00:00,"Sri Lanka's Prime Minister Mahinda Rajapaksa resigns amid mass protests over the country's worst economic crisis since independence

https://t.co/CP8AbIuoHH"
1523320836928991233,2022-05-08 15:16:04+00:00,"Dennis Waterman, star of TV shows Minder, The Sweeney and New Tricks, has died aged 74, his family says https://t.co/BvlvZ8tOgR"
1523270213399384064,2022-05-08 11:54:54+00:00,"Sex Education star Ncuti Gatwa will take over from Jodie Whittaker as the next Dr Who, the BBC announces

https://t.co/bph39wnLie"
1523000275396612102,2022-05-07 18:02:16+00:00,"Historic election result in Northern Ireland as Sinn Féin wins most assembly seats for first time, pushing DUP into second place https://t.co/SoaSzpPbSD"
1522621604534145027,2022-05-06 16:57:34+00:00,"The SNP finishes as biggest party in Scottish council elections - with Labour in second after the Conservatives suffer big losses

https://t.co/CPjNN1zMO1"
1522578220930981891,2022-05-06 14:05:10+00:00,Prince Harry and Andrew will not join other royals on Buckingham Palace balcony for Queen's Platinum Jubilee celebrations https://t.co/CYq72X4dy1
1522558726997258242,2022-05-06 12:47:42+00:00,"UK opposition leader Labour's Keir Starmer investigated by police over alleged Covid breach last year

https://t.co/PYFq62hykT"
1522551639068004356,2022-05-06 12:19:33+00:00,"More than 16,000 jobs at risk as convenience store McColl's collapses into administration https://t.co/yCrCXNFP2M"
1522260175536676866,2022-05-05 17:01:22+00:00,"Russia's President Vladimir Putin apologised after his foreign minister said that Nazi leader Adolf Hitler had ""Jewish blood"", Israel says

https://t.co/np8EuzatYX"
1522186459377188874,2022-05-05 12:08:27+00:00,"World’s true death toll from Covid pandemic is nearly 15 million, three times the official figure, says World Health Organization https://t.co/su3hF3BN9g"
1522170624168558592,2022-05-05 11:05:32+00:00,"UK interest rates raised from 0.75% to 1%, their highest level since 2009, as Bank of England tries to tackle cost of living https://t.co/bYQ9B8Ms72"
1521745486058770432,2022-05-04 06:56:11+00:00,"EU unveils plan to ban all Russian oil imports in major new sanctions package over Moscow's war in Ukraine

Follow latest here https://t.co/Z9eEeqsJlN"
1520761599283404801,2022-05-01 13:46:34+00:00,"Evacuation of civilians trapped in a steel plant in the Ukrainian city of Mariupol is underway, UN says

Follow the latest https://t.co/o9q503pUrp"
1520398983558045696,2022-04-30 13:45:39+00:00,"Neil Parish says he's resigning as an MP after admitting he watched pornography twice in the House of Commons 

https://t.co/gz7CGh721v"
1520375657573892096,2022-04-30 12:12:58+00:00,"Conservative MP Neil Parish, who is being investigated for allegedly watching pornography in the House of Commons, expected to resign - BBC told

https://t.co/gnEDqFemXz"
1520086729633501184,2022-04-29 17:04:52+00:00,British-born Islamic State militant Alexanda Kotey sentenced to life over murders of American hostages in Syria https://t.co/jG7FdBIofT
1520052879314362369,2022-04-29 14:50:22+00:00,"Former Wimbledon champion Boris Becker jailed for two and half years for hiding assets to avoid paying debts

https://t.co/afBKGESjAx"
1520048652164780034,2022-04-29 14:33:34+00:00,"Conservative MP Neil Parish investigated for allegedly watching pornography in the House of Commons

https://t.co/wcJuJW8BEg"
1519700220388458496,2022-04-28 15:29:01+00:00,"US President Biden proposes record $33bn aid package to help Ukraine, hours after Russia warns West against sending more weapons 

https://t.co/DO0CGL4KH1"
1519690837654966272,2022-04-28 14:51:44+00:00,"British national killed in Ukraine and second is missing, Foreign Office says

https://t.co/ZfZaPNcqOk"
1519569434242863105,2022-04-28 06:49:20+00:00,"Man charged with murders of four family members stabbed to death in south-east London
https://t.co/bJI8ntsXma"
1519320966773547010,2022-04-27 14:22:00+00:00,"DJ Tim Westwood steps down from Capital Xtra show following sexual misconduct claims
https://t.co/dU5T6ZhI56"
1519259243370749952,2022-04-27 10:16:44+00:00,"Government policies of discharging patients from hospital to care homes in England at start of pandemic were ""unlawful"", High Court judges rule https://t.co/WGs14LNBqW"
1518923862586675202,2022-04-26 12:04:03+00:00,"Ex-Radio 1 DJ Tim Westwood accused of sexual misconduct by multiple women, in joint investigation by BBC and Guardian
 
https://t.co/oRt5O2cHCx"
1518666500877529091,2022-04-25 19:01:23+00:00,"Twitter's board agrees to $44bn takeover by Elon Musk, who has promised to ""unlock"" the social media giant's potential https://t.co/ObcThxnJlX"
1518289473846530049,2022-04-24 18:03:13+00:00,"Emmanuel Macron set for clear victory in France’s presidential election, beating far right candidate Marine Le Pen, projections show https://t.co/eT5ZLZRguL"
1517165974696468486,2022-04-21 15:38:50+00:00,UK MPs approve inquiry into whether Prime Minister Boris Johnson misled Parliament over parties held during Covid lockdown https://t.co/Xu4Rnxeovt
1517146267192750082,2022-04-21 14:20:31+00:00,"Mother, stepdad and teenage boy guilty of murdering five-year-old Logan Mwangi https://t.co/NfuTg587pY"
1517133237352550400,2022-04-21 13:28:45+00:00,James Watson found guilty of murdering six-year-old Rikki Neave 28 years ago https://t.co/bweWrNAc8v
1517051633707925504,2022-04-21 08:04:29+00:00,"Russian President Vladimir Putin abandons plan to storm last Mariupol hold-out

https://t.co/m2nMSnQlxA"
1517008210569351171,2022-04-21 05:11:56+00:00,"A woman who has given more than £2m to the Conservative Party was listed as a director of a company secretly owned by a sanctioned Russian oligarch, documents seen by the BBC indicate https://t.co/G7UKMRFkwY"
1516823151186956288,2022-04-20 16:56:35+00:00,"Report into fatal shooting by actor Alec Baldwin finds production company showed ""plain indifference"" to employee safety

https://t.co/bXLEypxFzV"
1516078836529737729,2022-04-18 15:38:56+00:00,"Police say they have spoken to First Minister Nicola Sturgeon after she was filmed apparently breaching Scotland's face mask rules and no further action necessary
 
https://t.co/LiSP3lkjME"
1515997737858355200,2022-04-18 10:16:41+00:00,"Seven people killed in missile strikes in western Ukrainian city of Lviv, officials say, in a marked escalation in attacks

https://t.co/KNuxi0pps9"
1515264508134105096,2022-04-16 09:43:05+00:00,"Russia bans UK Prime Minister Boris Johnson and other senior ministers from entering Russia over the UK's ""hostile"" stance on the war in Ukraine https://t.co/cwXPnnoxun"
1514698702576832515,2022-04-14 20:14:47+00:00,"Russian warship Moskva has sunk, state media says, a day after it was reported damaged by fire or a Ukrainian missile strike
https://t.co/MEzEbijkrC"
1514637690104598528,2022-04-14 16:12:20+00:00,"Blood money being paid for Russian oil, Ukraine's President Zelensky tells BBC

https://t.co/WFIJNARXHt"
1514544870567911424,2022-04-14 10:03:30+00:00,"Some UK asylum seekers to be sent 4,000 miles away to Rwanda and military to take control of patrolling Channel, PM Boris Johnson announces
https://t.co/YeJwtYvB43"
1514306263089356813,2022-04-13 18:15:22+00:00,Police arrest man suspected of shooting 10 commuters in rush hour attack at New York City subway station https://t.co/0O86HPN0Gk
1514201569608318978,2022-04-13 11:19:21+00:00,IS fanatic Ali Harbi Ali given whole-life jail sentence for murdering UK MP Sir David Amess https://t.co/yMYBGJGmF8
1514025407137337347,2022-04-12 23:39:20+00:00,"New York police name Frank James, 62, as person of interest in subway shooting that injured more than 20 https://t.co/CzDAmW5S2u"
1513876017731014672,2022-04-12 13:45:43+00:00,"Multiple people injured in subway shooting in Brooklyn, New York https://t.co/y3P9VSSFlu"
1513861588255657987,2022-04-12 12:48:23+00:00,UK Prime Minister Boris Johnson and Chancellor Rishi Sunak will be fined over Downing Street lockdown parties https://t.co/gTBBsa0bQw
1513829434620628995,2022-04-12 10:40:37+00:00,"UK police issue at least 30 more Downing Street lockdown fines

https://t.co/DtA4rCWh0e"
1513538740861513736,2022-04-11 15:25:30+00:00,UK MP Imran Ahmad Khan guilty of sexually assaulting 15-year-old boy at party in 2008 https://t.co/FvJpH5HWKh
1513486975814225920,2022-04-11 11:59:48+00:00,"Man found guilty of murdering UK MP Sir David Amess, who was stabbed more than 20 times during constituency surgery https://t.co/D0pS3HjKFm"
1512796046077972492,2022-04-09 14:14:18+00:00,UK Prime Minister Boris Johnson is in Kyiv for talks with Ukraine's President Zelensky  https://t.co/bUlC7310Yp
1512507631050674177,2022-04-08 19:08:14+00:00,"Will Smith banned from Oscars gala and other Academy events for 10 years after slapping comic Chris Rock at the Oscars

https://t.co/1zvNALhFUI"
1512494201610592259,2022-04-08 18:14:53+00:00,"UK Chancellor Rishi Sunak's wife Akshata Murty announces she will pay UK taxes on her overseas income, following a row over her non-dom status
https://t.co/P6KJAmaCl2"
1512389039026024453,2022-04-08 11:17:00+00:00,"Russian President Vladimir Putin's daughters targeted by new UK sanctions

https://t.co/ZZe9eLKqBv"
1512363228315148293,2022-04-08 09:34:26+00:00,Man jailed for life with minimum term of 36 years for murder of London primary school teacher Sabina Nessa https://t.co/B5EleI8iNf
1512356574223814657,2022-04-08 09:08:00+00:00,Dozens feared dead and more than 100 wounded after missile strike on railway station used to evacuate civilians in Ukraine https://t.co/6iNHGPR2kJ
1512135150070640646,2022-04-07 18:28:08+00:00,"Ketanji Brown Jackson to become first black female justice in the 233-year history of US Supreme Court after Senate confirmation 

https://t.co/SIWmPuFwfo"
1512096985825882117,2022-04-07 15:56:29+00:00,Russia suspended from UN Human Rights Council https://t.co/BdI7X8up20
1511996508471709701,2022-04-07 09:17:13+00:00,"MI5 agent alleged to have exploited his status to abuse a partner cannot be named by the BBC, High Court rules https://t.co/NCuZGPFNAt"
1511814314029719557,2022-04-06 21:13:15+00:00,Scientists may have found the first fossil remains of a dinosaur that died on the very day a huge asteroid collided with the Earth https://t.co/7d4T7tMCid
1511628698939805701,2022-04-06 08:55:41+00:00,Ed Sheeran wins High Court copyright battle over 2017 hit Shape of You https://t.co/nvXkG9coxb
1511363899928498177,2022-04-05 15:23:28+00:00,"Ukrainian President Zelensky tells UN that Russian soldiers killed and tortured ""just for pleasure"" as he calls on world to act https://t.co/KfTpoKFov4"
1511000278325248010,2022-04-04 15:18:34+00:00,"""It's time to stop burning our planet and start investing in the abundant renewable energy""

UN Secretary General Antonio Guterres says ""leaders must lead"" but also urges people to ""demand that renewable energy is introduced now at speed and at scale""
https://t.co/4Pl8HEFbF1 https://t.co/VOGdCyptVB"
1510997935420579851,2022-04-04 15:09:15+00:00,"UN says it's ""now or never"" to avoid disastrous climate change - but we can do it if we make drastic changes to how we live

https://t.co/bQwOSsYUYk"
1510962828668190725,2022-04-04 12:49:45+00:00,Obituary: Legendary EastEnders actress June Brown https://t.co/3KwTYvJaAv
1510955202643476481,2022-04-04 12:19:27+00:00,"June Brown, who played Dot Cotton on BBC soap EastEnders for more than 30 years, dies aged 95 https://t.co/OJtze66Cr1"
1510954310552719367,2022-04-04 12:15:54+00:00,"BBC witnesses more evidence of atrocities against civilians near Kyiv, as Ukraine accuses Russia of genocide https://t.co/GN1rzN0b5c"
1510938017199886336,2022-04-04 11:11:09+00:00,Tesla boss Elon Musk buys 9.2% stake in Twitter worth almost $3bn https://t.co/A6dkPkBo5l
1510832132985344000,2022-04-04 04:10:25+00:00,"She held on as Hong Kong's leader through mass protests. Now, Carrie Lam says she won't seek a second term in power https://t.co/hlnmE83Yy1"
1510616089746710536,2022-04-03 13:51:56+00:00,"""This is a very tragic situation"": At least six people dead after automatic gunfire in busy nightlife area of Sacramento in California

https://t.co/Hml2BOIoNU"
1510313110850224129,2022-04-02 17:48:00+00:00,Tory MP David Warburton suspended from the parliamentary party pending investigation into allegations about conduct https://t.co/vu6MpUjSes
1510032354064183298,2022-04-01 23:12:22+00:00,"""The list of those I have hurt is long"": Actor Will Smith resigns from Oscars Academy after slapping Chris Rock https://t.co/IQscPvsWj5"
1509300487371251729,2022-03-30 22:44:12+00:00,"Will Smith was asked to leave Oscars ceremony after hitting Chris Rock but refused, Academy says https://t.co/WqW09kNXIc"
1509204247145066509,2022-03-30 16:21:46+00:00,"The Wanted star Tom Parker dies aged 33 after being diagnosed with terminal brain cancer
https://t.co/zuyb1Nz1oP"
1509118778411466759,2022-03-30 10:42:09+00:00,"""Nothing very promising"" in peace talks with Ukraine so far, Russian President Putin's spokesman says

Follow live updates here: https://t.co/PXAC9A5ZB0"
1508821749764341765,2022-03-29 15:01:52+00:00,"More than 200 babies in England might have survived if they had been given better maternity care by NHS Trust, BBC learns https://t.co/kCdUjqDnY1"
1508776467659960327,2022-03-29 12:01:56+00:00,"Russia says it will ""drastically reduce"" assault on Ukraine's capital Kyiv, where its advance is stalled https://t.co/OQQ128oy8i"
1508723571190910979,2022-03-29 08:31:44+00:00,"Police recommend 20 fines should initially be issued over Downing Street parties that breached Covid lockdown rules

https://t.co/7m7iniTyF1"
1508590100124422146,2022-03-28 23:41:22+00:00,“My behaviour was unacceptable and inexcusable” - Will Smith apologises after slapping Chris Rock at the Oscars https://t.co/GCUFe3DPrJ
1508527923996905484,2022-03-28 19:34:18+00:00,"The Oscars film academy ""condemns"" Will Smith's slapping of Chris Rock and says it has launched formal review of incident https://t.co/cHWY1pRs9W"
1508487039464976385,2022-03-28 16:51:51+00:00,"Russian billionaire Roman Abramovich suffered symptoms of suspected poisoning at peace talks in Kyiv earlier this month, spokesperson says https://t.co/SBs3nSLJVy"
1507633093670318082,2022-03-26 08:18:34+00:00,"Drummer with US rock group Foo Fighters, Taylor Hawkins, dies aged 50, band announces https://t.co/H6bPbfQN9h"
1507280114685558798,2022-03-25 08:55:57+00:00,EU signs US gas deal to curb reliance on Russian energy https://t.co/2BzhjWU8Wl
1506904915863642114,2022-03-24 08:05:03+00:00,"North Korea tests banned intercontinental missile for first time since 2017, according to South Korea https://t.co/IkzVRF82UA"
1506704072908357639,2022-03-23 18:46:58+00:00,"Madeleine Albright, first woman to become US secretary of state, dies aged 84 https://t.co/hfQvaXTqTw"
1506594361743654913,2022-03-23 11:31:01+00:00,"Gas incident closes London Aquatics Centre

https://t.co/hT1OMscwgD"
1506528342777999360,2022-03-23 07:08:41+00:00,"UK prices rose by 6.2% in the 12 months to February - the fastest for 30 years - as fuel, energy and food costs surged

https://t.co/iyv2NxnDw0"
1506463263801884673,2022-03-23 02:50:05+00:00,"World number one Ashleigh Barty has announced her retirement from tennis to ""chase other dreams"" – aged just 25 https://t.co/gU1OYtKIDX"
